{
  "schema_version": "1.0",
  "title": "OpenConstruction Task Vocabulary",
  "description": "Controlled vocabulary and lightweight taxonomy for benchmarkable computer vision, multimodal, BIM, and AEC task labels used across OpenConstruction catalogs.",
  "categories": [
    {
      "id": "recognition-classification",
      "name": "Recognition and Classification",
      "description": "Tasks that assign labels to scenes, objects, events, defects, text, or BIM entities."
    },
    {
      "id": "detection-localization",
      "name": "Detection and Localization",
      "description": "Tasks that detect, localize, track, or estimate object, action, pose, or change instances."
    },
    {
      "id": "segmentation-parsing",
      "name": "Segmentation and Parsing",
      "description": "Tasks that partition images, videos, floor plans, point clouds, or BIM content into structured regions or classes."
    },
    {
      "id": "reconstruction-registration",
      "name": "Reconstruction and Registration",
      "description": "Tasks that recover geometry, align representations, or reconstruct models from observations."
    },
    {
      "id": "generation-synthesis",
      "name": "Generation and Synthesis",
      "description": "Tasks that generate images, layouts, scenes, models, captions, or other derived artifacts."
    },
    {
      "id": "retrieval-search",
      "name": "Retrieval and Search",
      "description": "Tasks that retrieve relevant cases, layouts, BIM information, ontologies, or other structured knowledge."
    },
    {
      "id": "prediction-recommendation",
      "name": "Prediction and Recommendation",
      "description": "Tasks that forecast future behavior or recommend actions, commands, or pathways."
    },
    {
      "id": "reasoning-qa-ie",
      "name": "Reasoning, QA, and Information Extraction",
      "description": "Tasks involving multimodal reasoning, question answering, graph reasoning, or extraction of structured information."
    },
    {
      "id": "mapping-navigation-spatial",
      "name": "Mapping, Navigation, and Spatial Understanding",
      "description": "Tasks centered on mapping, localization, depth, visualization, or spatial scene understanding."
    },
    {
      "id": "planning-simulation-optimization",
      "name": "Planning, Simulation, and Optimization",
      "description": "Tasks focused on workflow planning, simulation, modeling, or optimization for design and construction processes."
    },
    {
      "id": "bim-cad-authoring",
      "name": "BIM and CAD Authoring",
      "description": "Tasks that create, query, automate, or author BIM and CAD models or workflows."
    },
    {
      "id": "analysis-assessment",
      "name": "Analysis and Assessment",
      "description": "Tasks that estimate, assess, count, or analyze domain-specific properties, risks, or lifecycle metrics."
    }
  ],
  "tasks": [
    {
      "id": "task.2d-to-bim-reconstruction",
      "canonical_key": "2d-to-bim reconstruction",
      "preferred_label": "2D-to-BIM reconstruction",
      "category_id": "bim-cad-authoring",
      "aliases": ["2D-to-BIM Reconstruction"],
      "broader_task_id": "task.bim-reconstruction",
      "related_task_ids": ["task.floorplan-to-bim", "task.scan-to-bim", "task.text-to-bim"],
      "description": "Reconstructs a BIM model from 2D drawings, floor plans, or other 2D inputs."
    },
    {
      "id": "task.3d-object-detection",
      "canonical_key": "3d object detection",
      "preferred_label": "3D object detection",
      "category_id": "detection-localization",
      "aliases": ["3D Object Detection"],
      "broader_task_id": "task.object-detection",
      "related_task_ids": ["task.point-cloud-segmentation"],
      "description": "Detects and localizes object instances in 3D data such as point clouds or meshes."
    },
    {
      "id": "task.3d-reconstruction",
      "canonical_key": "3d reconstruction",
      "preferred_label": "3D reconstruction",
      "category_id": "reconstruction-registration",
      "aliases": ["3D Reconstruction"],
      "related_task_ids": ["task.structure-from-motion", "task.3d-registration", "task.bim-reconstruction"],
      "scope_note": "Use for generic recovery of 3D geometry or scene structure. Prefer narrower labels such as Structure from motion, BIM reconstruction, or 3D registration when those are the actual benchmark targets.",
      "description": "Recovers 3D geometry or structure from images, video, scans, or other observations."
    },
    {
      "id": "task.3d-registration",
      "canonical_key": "3d registration",
      "preferred_label": "3D registration",
      "category_id": "reconstruction-registration",
      "aliases": ["BIM alignment"],
      "related_task_ids": ["task.pcd-bim-matching", "task.scan-to-bim", "task.bim-reconstruction"],
      "scope_note": "Use for geometric alignment and registration problems, including scan-to-BIM alignment.",
      "description": "Aligns two or more 3D representations into a common coordinate frame."
    },
    {
      "id": "task.3d-semantic-segmentation",
      "canonical_key": "3d semantic segmentation",
      "preferred_label": "3D semantic segmentation",
      "category_id": "segmentation-parsing",
      "aliases": [],
      "broader_task_id": "task.semantic-segmentation",
      "related_task_ids": ["task.point-cloud-segmentation"],
      "scope_note": "Use when semantic labeling is defined over generic 3D representations such as point clouds, voxels, meshes, or surfaces. Prefer Point cloud segmentation when the benchmark is explicitly point-cloud-centric.",
      "description": "Assigns semantic class labels to points, voxels, or surfaces in 3D data."
    },
    {
      "id": "task.6-dof-pose-estimation",
      "canonical_key": "6-dof pose estimation",
      "preferred_label": "6-DoF pose estimation",
      "category_id": "detection-localization",
      "aliases": ["6-DOF pose estimation"],
      "broader_task_id": "task.pose-estimation",
      "related_task_ids": ["task.robot-grasp-pose-estimation"],
      "description": "Estimates full 6-degree-of-freedom position and orientation for an object or camera."
    },
    {
      "id": "task.action-recognition",
      "canonical_key": "action recognition",
      "preferred_label": "Action recognition",
      "category_id": "recognition-classification",
      "aliases": [],
      "description": "Classifies the action occurring in an image sequence or video clip."
    },
    {
      "id": "task.activity-detection",
      "canonical_key": "activity detection",
      "preferred_label": "Activity detection",
      "category_id": "detection-localization",
      "aliases": ["Activity Detection"],
      "description": "Detects and temporally localizes activities or events in video or sensor streams."
    },
    {
      "id": "task.automatic-compliance-checking",
      "canonical_key": "automatic compliance checking",
      "preferred_label": "Automatic compliance checking",
      "category_id": "analysis-assessment",
      "aliases": [],
      "description": "Checks whether a design, model, or process satisfies specified codes, rules, or constraints."
    },
    {
      "id": "task.autonomous-bim-authoring",
      "canonical_key": "autonomous bim authoring",
      "preferred_label": "Autonomous BIM authoring",
      "category_id": "bim-cad-authoring",
      "aliases": [],
      "description": "Automates BIM model creation through agents, commands, or high-level instructions."
    },
    {
      "id": "task.behavior-cloning",
      "canonical_key": "behavior cloning",
      "preferred_label": "Behavior cloning",
      "category_id": "prediction-recommendation",
      "aliases": [],
      "description": "Learns to imitate demonstrated actions or interaction sequences from examples."
    },
    {
      "id": "task.bim-automation",
      "canonical_key": "bim automation",
      "preferred_label": "BIM automation",
      "category_id": "bim-cad-authoring",
      "aliases": [],
      "description": "Automates BIM authoring, editing, checking, or related software workflows."
    },
    {
      "id": "task.bim-command-recommendation",
      "canonical_key": "bim command recommendation",
      "preferred_label": "BIM command recommendation",
      "category_id": "prediction-recommendation",
      "aliases": ["BIM Command Recommendation"],
      "description": "Recommends the next BIM command or operation based on user context or history."
    },
    {
      "id": "task.bim-object-classification",
      "canonical_key": "bim object classification",
      "preferred_label": "BIM object classification",
      "category_id": "recognition-classification",
      "aliases": ["BIM Object Classification"],
      "description": "Assigns semantic or type labels to objects represented in BIM content."
    },
    {
      "id": "task.bim-querying",
      "canonical_key": "bim querying",
      "preferred_label": "BIM querying",
      "category_id": "retrieval-search",
      "aliases": [],
      "description": "Retrieves structured information from BIM models in response to user or system queries."
    },
    {
      "id": "task.bim-reconstruction",
      "canonical_key": "bim reconstruction",
      "preferred_label": "BIM reconstruction",
      "category_id": "reconstruction-registration",
      "aliases": [],
      "related_task_ids": ["task.2d-to-bim-reconstruction", "task.floorplan-to-bim", "task.scan-to-bim", "task.text-to-bim", "task.3d-reconstruction"],
      "scope_note": "Use as the broad parent concept for modality-specific BIM reconstruction tasks. Prefer the narrower modality-specific task when the input source is explicit.",
      "description": "Recovers BIM geometry or semantics from drawings, scans, text, or other observations."
    },
    {
      "id": "task.building-detection",
      "canonical_key": "building detection",
      "preferred_label": "Building detection",
      "category_id": "detection-localization",